,曲名,発売日,表示回数,歌詞
0,翡翠の狼,2017-02-15,"228,635",孤独の寂しさ噛み砕いて　沸き立つ思いに耳を傾けて泥濘踏みつけ歩いていけ　嵐の中涙流しながら翡翠の狼はまた嘆く　その身に宿す美しさも知らず高めの崖を前にほら嘆く　誰かの力借りりゃ楽なのにもうじき誰か友だちがくるさ口笛吹きながら夢を見ていたどこまで行くのか決めてなんかないがひたすらあなたに会いたいだけ知らない間に遠くまで来たが暖かい場所はまだ向こうかりんごの花咲く春の日まで　心の目印曇らせないように吹雪に曝され歩いていけ　虚しさ抱え混沌の最中まで翡翠の狼は絶え間なく　我が身に怒りを向けては歌を歌う戦え誰にも知られぬまま　それで自分を愛せるのならばかけがえのないものはなんだろな踵鳴らしながら待ちぼうけだ消せない記憶と苦しみの中で終わりが来るのをただ待つだけこの世で誰より綺麗なあなたに愛しているよと伝えるまでどこまで行くのか決めてなんかないがひたすらあなたに会いたいだけ知らない間に遠くまで来たが暖かい場所はまだ向こうか消せない記憶と苦しみの中で終わりが来るのをただ待つだけこの世で誰より綺麗なあなたに愛しているよと伝えるまでこの歌詞をマイ歌ネットに登録 >このアーティストをマイ歌ネットに登録 >
0,ひまわり,2020-08-05,"213,949",悲しくって　蹴飛ばした　地面を強く跳ねっ返る　光に指を立てて愛したくて　噛み付いた　喉笛深くその様が　あんまりに美しくてさあ舌を打って　曠野の中　風に抗い夜もすがら　嗄れた産声で歌う遠く遠く見据えていた　凍て星の先まで痣だらけの心　輝かせてその姿をいつだって　僕は追いかけていたんだ転がるように線を貫いて　突き刺していく切っ先を日陰に咲いたひまわりが　今も夏を待っている人いきれを裂いて笑ってくれ　僕の奥でもう一度消し飛べ　散弾銃をぶち抜け　明日へ吐き出せ　北極星へ舵取れ　その手で傷ついて　静脈を不意に巡るエレキ掻き毟って　吹き荒び　鳴る哀歌聴こえているあの時から　少しも絶えぬまま震えるほど全て　消えないぜその姿がいつだって　僕を映し出していたもしも同じ街で生まれたら　君のようになれたかな日陰に咲いたひまわりが　今も海を見つめてる聴こえるなら強く叫んでくれ　僕の名をもう一度鳴き声　かんかん照りの街路で　侘び戯れ解き放て　乱反射して遠くへ　鳴り響けその姿をいつだって　僕は追いかけていたんだ転がるように線を貫いて　突き刺していく切っ先を日陰に咲いたひまわりが　今も夏を待っている人いきれを裂いて笑ってくれ　僕の奥でもう一度消し飛べ　散弾銃をぶち抜け　明日へ吐き出せ　北極星へ舵取れ　その手でこの歌詞をマイ歌ネットに登録 >このアーティストをマイ歌ネットに登録 >
0,百鬼夜行,2013-05-29,"368,989",ちゃんちゃらおかしな出で立ちでまた酒呑み呷れど日は暮れずつまらん顔して街を行くほらあれこれ言うては酔い散らすいや　どだいもどだいに面倒でおかしな飲ん兵衛だオンボロ錦の更紗模様その洒落たお顔には金魚の絵腰やら股やら働かせまたお手軽欲望貪れば今どこへも聞こえる声出した「私さみしいの」呼ばれて飛び出てこの世に参上皆様よろしくどうぞ楽しくなったり哀しくなったり忙しのない日ばかりだ帳を上げろや昼行灯ほらここらでおひとつどうだ我らは現代の妖怪だ!頓珍漢なことばかりまだ信じている狸の背中に火を灯せば　ほうあんあん　ぱっぱらぱの行進やってやれほらバケツ叩いては声上げろや　ほう明るい夜の到来だ　ようそろみなみな欲望詰め込んだそのペラペラ少女とニヤケ猿お願い全てを投げ付けてまた一人で快楽部屋の隅ほら頭と目ばっか肥えて行き青白い顔雨降る夜には傘になりその体で誰かと雨宿りお歌を歌えば人を騙しまた誰彼構わず慰めるほら盲信者増やして傘下に置いて孤独で遊説を生まれて初めてこの世に登場続きは表でどうぞ嬉しくなったり怒り狂ったり忙しのない日ばかりだその手を下ろせや用心棒ほらここらでおひとつどうだ我らは現代の妖怪だ!どんでんひっくり返し行こうやスチャラカほいさ狐の頭に水被せば　ほうあんあん　ぱっぱらぱの行進やってやれほら薬缶鳴らしては声合わせや　ほう明るい夜の到来だ　ようそろこんな具合になったのは誰のお陰だろうかこんな具合になったのはああいまさらどうでもええわこんな具合になったのは誰のお陰だろうかこんな具合になったのはああいまさらどうでもええわ頓珍漢なことばかり　まだ信じている狸の背中に火を灯せば　ほうあんあん　ぱっぱらぱの行進やってやれほらバケツ叩いては声上げろや　ほう明るい夜の到来だ　ようそろちゃんちゃらおかしな世の中だその平和と愛とをうたえども心にあるのはそれではないまた僕らに自由はそれほどないほら　得意の炎で焼いてくれあなたの言う愛でこの歌詞をマイ歌ネットに登録 >このアーティストをマイ歌ネットに登録 >
0,vivi,2012-05-16,"1,092,916",悲しくて飲み込んだ言葉ずっと後についてきた苛立って投げ出した言葉きっともう帰ることはない言葉にすると嘘くさくなって形にするとあやふやになって丁度のものはひとつもなくて不甲斐ないや愛してるよ、ビビ明日になればバイバイしなくちゃいけない僕だ灰になりそうなまどろむ街をあなたと共に置いていくのさあなたへと渡す手紙のためいろいろと思い出したどれだって美しいけれども一つも書くことなどないんだでもどうして、言葉にしたくなって鉛みたいな嘘に変えてまで行方のない鳥になってまで汚してしまうのか愛してるよ、ビビ明日になれば今日の僕らは死んでしまうさこんな話など忘れておくれ言いたいことは一つもないさ溶け出した琥珀の色落ちていく気球と飛ぶカリブー足のないブロンズと踊りを踊った閑古鳥忙しなく鳴るニュース「街から子供が消えていく」泣いてるようにも歌を歌う魚が静かに僕を見るどうにもならない心でもあなたと歩いてきたんだ愛してるよ、ビビ明日になればバイバイしなくちゃいけない僕だ灰になりそうなまどろむ街をあなたと共に置いていくのさ言葉を吐いて体に触れてそれでも何も言えない僕だ愛してるよ、ビビ愛してるよ、ビビさよならだけが僕らの愛だこの歌詞をマイ歌ネットに登録 >このアーティストをマイ歌ネットに登録 >
0,ピースサイン,2017-06-21,"1,384,708",いつか僕らの上をスレスレに通り過ぎていったあの飛行機を不思議なくらいに憶えてる意味もないのに　なぜか不甲斐なくて泣いた日の夜にただ強くなりたいと願ってたそのために必要な勇気を探し求めていた残酷な運命が定まってるとしてそれがいつの日か僕の前に現れるとしてただ一瞬　この一瞬　息ができるならどうでもいいと思えた　その心をもう一度遠くへ行け遠くへ行けと僕の中で誰かが歌うどうしようもないほど熱烈にいつだって目を腫らした君が二度と悲しまないように笑えるそんなヒーローになるための歌さらば掲げろピースサイン転がっていくストーリーを守りたいだなんて言えるほど君が弱くはないのわかってたそれ以上に僕は弱くてさ君が大事だったんだ「独りで生きていくんだ」なんてさ口をついて叫んだあの日から変わっていく僕を笑えばいい独りが怖い僕を蹴飛ばして噛み付いて息もできなくて騒ぐ頭と腹の奥がぐしゃぐしゃになったって衒いも外連も消えてしまうくらいに今は触っていたいんだ　君の心に僕たちはきっといつか遠く離れた太陽にすら手が届いて夜明け前を手に入れて笑おうそうやって青く燃える色に染まりおぼろげな街の向こうへ手をつないで走っていけるはずだ君と未来を盗み描く捻りのないストーリーをカサブタだらけ荒くれた日々が削り削られ擦り切れた今が君の言葉で蘇る　鮮やかにも　現れていく蛹のままで眠る魂を食べかけのまま捨てたあの夢をもう一度取り戻せもう一度遠くへ行け遠くへ行けと僕の中で誰かが歌うどうしようもないほど熱烈にいつだって目を腫らした君が二度と悲しまないように笑えるそんなヒーローになるための歌さらば掲げろピースサイン転がっていくストーリーを君と未来を盗み描く　捻りのないストーリーをこの歌詞をマイ歌ネットに登録 >このアーティストをマイ歌ネットに登録 >
0,笛吹けども踊らず,2013-05-29,"105,905",でもなんでこうなったんだ　ここで今何してんだギラギラの目の人たちにあらぬ疑いをかけられて沢山の流言飛語が　息巻いて飛び交う部屋に着の身着のまま放り込まれた俺は一体何をした?何らかの勘違いで　俺は今冤罪を背負って身に覚えなどない言葉で埒のあかない押し問答切り取った密室に浮かぶ　煩雑と食傷の空気巡り巡れど罪もなしもういいかい、もういいかいすっからかんになったしさあ　さあそんなもんはやっちゃないさ　放っておいてや充分さ、充分だ悪いのは誰だろうなあ　なあ立ち込んだ青い吐息　白々しい目を向けられているでもなんでこうなったんだ　ここで今何してんだヘトヘトの目の人たちは昨日の夜のことばかり問う俺は酒を呑んだんだ　夜の淵踊ったんだそしたら靴が脱げ落ちて　夜の魚に食べられたその後は…その後はそれは確かに覚えてない!もういいかい、もういいかいすっからかんになったしさあ　さあそんなもんはやっちゃないさ　放っておいてや充分さ、充分だ悪いのは誰だろうなあ　なあ立ち込んだ青い吐息　白々しい目を向けられているもういいや、もういいや、そろそろ終わりにしよう　なあ皆呼んで踊ろうや　手を叩いてさハレルヤ、ハレルヤ誰も悪くないだろうなあ　なあ円満で終わろうや　手を繋いでさ笛吹けども踊らずこの歌詞をマイ歌ネットに登録 >このアーティストをマイ歌ネットに登録 >
0,fogbound ( + 池田エライザ),2017-11-01,"232,680",「このキャンディが溶けてなくなるまではそばにいて」と言った切れかけで点った蛍光灯の下で　現れては消えるテーブルを焦がして残った跡が　嫌に目に付いて笑えるどこで道を間違えたのか　見失ったポラリス　航海の途中悪魔じゃない　天使なんかじゃない　現れては消えるようそろう　向かうのはホロウお守り賜う　セントエルモようそろう　目の前は最深部ブラックアウトの向こう　もう一度悲しみで船を漕ぐ救えないビリーバーメロドラマはもうおしまいにしようね北へ向かうハイウェイでパンクして呆然　割れたタイヤが笑えるコーヒーを零して染みた跡が　嫌に目に付く夜を誘う怠めの音楽　トレモロの響き　座礁の途中アップアンドダウン　ナイトクルージングなんていいもんじゃないもうよそう　思い出はメロウ前頭葉切ろう　なんて妄想もうよそう　傷つけ合うのをお帰り願う　もう二度と痣だらけ頼りないサンデードライバーメロドラマはもうおしまいにしようね明るい部屋にあなたとふたり暗い部屋にはあなたはいない明るい部屋にあなたとふたり暗い部屋にはあなたはいないあてどなく彷徨う笑えないドリーマーメロドラマはもうおしまいねようそろう　向かうのはホロウお守り賜う　セントエルモようそろう　目の前は最深部ブラックアウトの向こう　もう一度もうよそう　思い出はメロウ前頭葉切ろう　なんて妄想もうよそう　傷つけ合うのをお帰り願う　もう二度とこの歌詞をマイ歌ネットに登録 >このアーティストをマイ歌ネットに登録 >
0,Flamingo,2018-10-31,"1,319,159",宵闇に　爪弾き　悲しみに雨曝し　花曇り枯れた街　にべもなし　佗びしげに鼻垂らし　へらへらり笑えないこのチンケな泥仕合　唐紅の髪飾り　あらましき恋敵触りたいベルベットのまなじりに　薄ら寒い笑みにあなたフラミンゴ　鮮やかなフラミンゴ　踊るままふらふら笑ってもう帰らない寂しさと嫉妬ばっか残して毎度あり　次はもっと大事にして御目通り　有難し　闇雲に舞い上がり　上滑り虚仮威し　口遊み　狼狽に軽はずみ　阿呆晒し愛おしいその声だけ聴いていたい　半端に稼いだ泡銭　タカリ出す昼鳶下らないこのステージで光るのは　あなただけでもいいそれはフラミンゴ　恐ろしやフラミンゴ　はにかんだふわふわ浮かんでもうさいならそりゃないね　もっとちゃんと話そうぜ畜生め　吐いた唾も飲まないで氷雨に打たれて鼻垂らし　あたしは右手にねこじゃらし今日日この程度じゃ騙せない　間で彷徨う常しえに地獄の閻魔に申し入り　あの子を見受けておくんなまし酔いどれ張り子の物語　やったれ死ぬまで猿芝居あなたフラミンゴ　鮮やかなフラミンゴ　踊るままふらふら笑ってもう帰らない寂しさと嫉妬ばっか残して毎度あり　次はもっと大事にしてこの歌詞をマイ歌ネットに登録 >このアーティストをマイ歌ネットに登録 >
0,Flowerwall,2015-01-14,"678,997",あの日君に出会えたそのときから透明の血が僕ら二人に通い悲しみも優しさも　希望もまた絶望も分け合えるようになった知りたいことがいくつもあるというのに僕らの時間はあまりに短くあとどれほどだろうか君と過ごす時間は　灯りが切れるのは君のその声が　優しく響いたこんな憂いも吹いて飛ばすようにフラワーウォール目の前に色とりどりの花でできた壁が今立ちふさがる僕らを拒むのか何かから守るためなのか解らずに立ち竦んでるそれを僕らは運命と呼びながらいつまでも手をつないでいたこのあまりに広い世界で僕たちは意味もなく同じ場所に立っていたのに僕の欠けたところと　君の欠けたところを何故かお互いに持っていたどうして僕らは　巡り会えたのかその為だけに　生まれてきた様なフラワーウォール独りでは片付けられないものだろうと君がいてくれたらほら限りない絶望も答えが出せない問いも全部ひとつずつ色づいていく離せないんだ　もしも手を離せば二度と掴めないような気がして誰も知らない見たことのないものならば今僕らで名前をつけようここが地獄か天国か決めるのはそう二人が選んだ道次第フラワーウォール目の前に色とりどりの花でできた壁が今立ちふさがる僕らを拒むのか何かから守るためなのか解らずに立ち竦んでるそれでも嬉しいのさ君と道に迷えることが沢山を分け合えるのがフラワーウォール僕らは今二人で生きていくことをやめられず笑いあうんだそれを僕らは運命と呼びながらいつまでも手をつないでいたこの歌詞をマイ歌ネットに登録 >このアーティストをマイ歌ネットに登録 >
0,フローライト,2015-10-07,"527,691",君が街を発つ前の日に　僕にくれたお守りそれが今も輝いたまま　君は旅に出ていった今は何処で何をしているかな　心配なんかしていない君のことだからな君が思うよりも君は　僕の日々を変えたんだ二人でいる夜の闇が　あんなに心地いいなんてこの世界のすべてを狭めたのは　自分自身ってことを君に教わったから壊そうと思えば瞬く間に　壊せてしまうものを僕はまだ壊れそうなほど　大事に握りしめているフローライト　こんなものが世界で一番輝いて見えるのはフローライト　きっと君が大切でいる何よりの証だろう確かめていたんだよ僕らは　ずっと目には見えないものをふいにそれは何かを通して　再び出会う夜が明ければ陽が昇る　道は永遠に続く素敵な魔法で溢れてる　僕らは今を生きているそれと同じくらいに君のことを信じてるってことを君は笑うだろうか確証なんてのは一つもない　でもね僕は迷わない君が信じたことなんだから　僕にはそれで十分さフローライト　こんなものが泣いているように見えるような気になるのはフローライト　いつか君が泣いていた顔をふっと思い出すからだろう説明がつかない僕らの　こんな心も全て通していつだって君が笑えるような　幸せを願うフローライト　こんなものが世界で一番輝いて見えるのはフローライト　きっと君が大切でいる何よりの証だろう確かめていたんだよ僕らは　ずっと目には見えないものをふいにそれは何かを通して　再び出会うこの歌詞をマイ歌ネットに登録 >このアーティストをマイ歌ネットに登録 >
0,Black Sheep,2012-05-16,"148,251",素晴らしい一日　始まる頃には夜に暮れる過ぎ行く毎日　手を振ることすら忘れたままいつか注いだ水が腐っていったんだここは濁った澱　そうだ　何にもありはしないな受話器の向こうでは霞掛かる声が鳴るばかり何を話しているのかはよくわからなかったいつの間にか酷く時間が経って鏡にあなたが映った　「もういいから遊ぼうよ」楽しいことが待っているさ　シャラララ黒い羊が一匹、二匹、三匹、四匹黒い羊が五匹、六匹、七匹、八匹目を閉じる夜は　枕に体が沈んでいくついには回りだす　部屋の中ベッドが彷徨えばいつか注いだ水が腐っていったんだここは濁った澱　そうだ　何にもありはしないな何となく不安でさ　日に日に毎日は老いていく騒がしい箱庭　ここは誰かのジオラマなのだ知らなくていいし　知りたくもないまた明日　全てを解った気になるんだな楽しいことが待っているさ　シャラララ黒い羊が九匹、十匹、十一匹、十二匹黒い羊が十三匹、十四匹、十五匹、十六匹楽しいことが待っているさ　シャラララ黒い羊が十七匹、十八匹、十九匹、二十匹黒い羊が二十一匹、二十二匹、二十三匹、二十四匹二十五匹、二十六匹、二十七匹、二十八匹二十九匹、三十匹、三十一匹、三十二匹三十三匹、三十四匹、三十五匹、三十六匹三十七匹、三十八匹、三十九匹、四十匹四十一匹、四十二匹、四十三匹、四十四匹、四十五匹黒い羊がこの歌詞をマイ歌ネットに登録 >このアーティストをマイ歌ネットに登録 >
0,Blue Jasmine,2015-10-07,"362,689",あなたの思い出話を聞く度　強く感じているんだよ僕はその過去一つ残らず　全てと生きていると差し出したジャスミンのお茶でさえ　泣き出しそうな顔をして戸惑いながら口を付けた　あなたを知っているよ沢山の道を選べるほど　上手には生きられなかったけど心も体も覚えている　あなたとなら生きていられるこれから僕らはどこへ行こう？　ねえダーリン何処だろうときっととなりにあなたがいるなら　それだけで特別なんだキスをして笑い合って　悪戯みたいに生きていこう全て失くしてもなくならないものを見つけたんだ昼間の星みたいに隠れて　今は見えないとしても幸せなんてのはどこにでも　転がり落ちていた眠るあなたの瞼の上　流れる睫毛を見ている僕は気づく　これからの日々が幸せだってこと誰とでも仲良く出来るほど　まともには心開けなくてでもあなたなら話せることを　あなたの為に用意していた寂しくってしかたがなくなって　それさえ隠せなくなってあなたの声が聞きたかった　あの夜をまだ覚えているんだこれからも同じ夜を　いくつも繰り返すんだろうその度に僕は確かめる　君を愛してると差し出したお茶を美味しそうに飲む　君のその笑顔が明日も明後日もそのまた先も　変わらなければいいこれから僕らはどこへ行こう？　ねえダーリン何処だろうときっととなりにあなたがいるなら　それだけで特別なんだキスをして笑い合って　悪戯みたいに生きていこう全て失くしてもなくならないものを見つけたんだいつでも僕は確かめる　君を愛してるとこの歌詞をマイ歌ネットに登録 >このアーティストをマイ歌ネットに登録 >
0,PLACEBO ＋ 野田洋次郎,2020-08-05,"355,869",熱っぽい夢を見てしまって　君のその笑顔で　絆された夕暮れこの想い気の迷いだって　笑えないよ全然袖が触れてしまった走り出したハートを攫って　繋いでいけビートの端くれ薫る胸に火を灯せ　踊り明かそう朝までしなり揺れるランウェイの先へ　僕の心連れてってくれ触れていたい　揺れていたい　君じゃないといけない　この惑い今だんだん恋になっていく　ときめいていく思いがけぬ　とんだランデブーどんどんハイになっていく　洒落込んでいく甘い罠に　やられていく　落ちていくいつかの偶然　確かめたいね　(いつかの偶然　確かめたいね)解き明かしたい　未踏のミステリー　(気づかないグラビティー)元のように　戻れないね　(元のように　戻れないね)どっか行こうぜ　冗談みたいに　(背反のアイロニー)それは一つのコメディ　または二つのトラジティどちらでも構わない君と二人ならばそれは一時のクレイジー　揺り返していくサニティ何もかもが　いつの間にか　変わり果てる魔法気持ち前に突っ込むステップで　飛ばしていけスイートな宇宙へ待ちに待った宵の果て　踊り明かそう朝まできらり照らすリップで酔わせて　とこしなえに誘ってくれ触れていたい　揺れていたい　君じゃないといけない　この惑い今だんだん愛になっていく　騒めいていく鉢合わせの　とんだピーカブー燦々照り出していく　謎めいていく甘い罠に　やられていく　落ちていく気の迷いじゃない　嘘じゃない想い思い込みじゃない　嘘じゃない想い気の迷いじゃない　嘘じゃない想い思い込みじゃない　嘘じゃない想い今だんだん恋になっていく　ときめいていく思いがけぬ　とんだランデブー今どんどんハイになっていく　洒落込んでいく甘い罠に　やられていく　落ちていくこの歌詞をマイ歌ネットに登録 >このアーティストをマイ歌ネットに登録 >
